{
  "candidate_name": "Alex Dupont",
  "title": "Senior Software Engineer",
  "experience": [
    {
      "role_line": "Senior Engineer",
      "metadata_line": "Acme Corp | Paris | January 2018 – Present",
      "bullets": ["Led API platform migration."]
    },
    {
      "role_line": "Software Engineer",
      "metadata_line": "Midway Systems | Lyon | January 2010 – December 2017",
      "bullets": ["Built distributed services."]
    },
    {
      "role_line": "C++ Developer",
      "metadata_line": "OldCo Media | Paris | January 1998 – December 2004",
      "bullets": ["C++ MFC desktop applications.", "Fortran to C++ migrations."]
    },
    {
      "role_line": "Expériences antérieures",
      "metadata_line": "TinyShop",
      "bullets": ["Premiers postes en développement logiciel (C++, desktop)."]
    }
  ],
  "education": [
    "2025 — Product Builder No-Code, École Cube (RNCP Niveau 6)",
    "1996 — MSc Computer Science, University X"
  ]
}
