{
  "candidate_name": "Alex Dupont",
  "title": "Senior Software Engineer",
  "experience": [
    {
      "role_line": "Senior Engineer",
      "metadata_line": "Acme Corp | Paris | January 2018 – Present",
      "bullets": ["Led API platform migration."]
    },
    {
      "role_line": "Product Builder No-Code (Formation)",
      "metadata_line": "École Cube | Paris | 2025",
      "bullets": ["RNCP Niveau 6."]
    }
  ],
  "education": []
}
