{
  "candidate_name": "Alex Dupont",
  "title": "Senior Software Engineer",
  "experience": [
    {
      "role_line": "Senior Engineer",
      "metadata_line": "Acme Corp | Paris | January 2018 – Present",
      "bullets": ["Led API platform migration."]
    },
    {
      "role_line": "C++ Developer",
      "metadata_line": "OldCo Media | Paris | January 1998 – December 2004",
      "bullets": ["Fortran to C++ migrations."]
    },
    {
      "role_line": "Expériences antérieures",
      "metadata_line": "TinyShop | Avant 1998",
      "bullets": ["Premiers postes en développement logiciel."]
    }
  ],
  "education": []
}
